titles,years,genres,imdb,runtime,description,stars,votes,type,original
A Christmas Prince,2017,"Comedy, Family, Romance",5.8,92 min,"When a reporter goes undercover as a tutor to get the inside scoop on a playboy prince, she gets tangled in some royal intrigue and ends up finding love - but will she be able to keep up her lie?","Alex Zamm, Rose McIver, Ben Lamb, Alice Krige, Honor Kneafsey","15,479",Movie,Netflix
A Babysitter's Guide to Monster Hunting,2020,"Comedy, Family, Fantasy",5.4,98 min,A babysitter embarks on a mission to save a child who's been abducted by monsters.,"Rachel Talalay, Tamara Smart, Oona Laurence, Tom Felton, Troy Leigh-Anne Johnson","2,160",Movie,Netflix
7 Años,2016,Drama,6.8,77 min,Four friends face an agonizing decision. One must go to prison. The other three must make the sacrifice worthwhile.,"Roger Gual, Juana Acosta, Alex Brendemühl, Paco León, Manuel Morón","4,252",Movie,Netflix
6 Underground,2019,"Action, Thriller",6.1,128 min,"Meet a new kind of action hero. Six untraceable agents, totally off the grid. They've buried their pasts so they can change the future.","Michael Bay, Ryan Reynolds, Mélanie Laurent, Manuel Garcia-Rulfo, Ben Hardy","133,450",Movie,Netflix
6 Balloons,2018,Drama,5.8,74 min,A woman (Jacobson) learns her brother (Franco) has relapsed on heroin.,"Marja-Lewis Ryan, Abbi Jacobson, Dave Franco, Charlotte Carel, Madeline Carel","3,534",Movie,Netflix
22 July,2018,"Crime, Drama, History",6.8,143 min,"A three-part story of Norway's worst terrorist attack in which over seventy people were killed. 22 July looks at the disaster itself, the survivors, Norway's political system and the lawyers who worked on this horrific case.","Paul Greengrass, Anders Danielsen Lie, Jonas Strand Gravli, Jon Øigarden, Maria Bock","27,059",Movie,Netflix
1922,2017,"Crime, Drama, Horror",6.3,102 min,"A simple yet proud farmer in the year 1922 conspires to murder his wife for financial gain, convincing his teenage son to assist. But their actions have unintended consequences.","Zak Hilditch, Thomas Jane, Molly Parker, Dylan Schmid, Kaitlyn Bernard","51,555",Movie,Netflix
15 August,2019,Drama,5.8,124 min,"On India's Independence Day, a zany mishap in a Mumbai chawl disrupts a young love story while compelling the residents to unite in aid of a little boy.","Swapnaneel Jaykar, Abhishek Deshmukh, Mrunmayee Deshpande, Namrata Kadam, Addinath Kothare",211,Movie,Netflix
13th,2016,"Documentary, Crime, History",8.3,100 min,An in-depth look at the prison system in the United States and how it reveals the nation's history of racial inequality.,"Ava DuVernay, Melina Abdullah, Michelle Alexander, Cory Booker, Dolores Canales","30,713",Movie,Netflix
#Realityhigh,2017,"Comedy, Drama, Romance",5.2,99 min,"High-achieving high-school senior Dani Barnes dreams of getting into UC Davis, the world's top veterinary school. Then a glamorous new friend draws her into a Southern California scene that threatens everything she's worked for.","Fernando Lebrija, Nesta Cooper, Keith Powers, Alicia Sanz, Jake Borelli","5,486",Movie,Netflix
"Yours Sincerely, Kanan Gill",2020,Comedy,7.2,72 min,"Revisiting life goals set in a letter written as a teen to his future self, comedian Kanan Gill reports back on if he's lived up to his own expectations.","Neville Shah, Kanan Gill",685,TV Show,Netflix
Yoo Byungjae: Too Much Information,2018,Comedy,5.3,63 min,"Korean stand-up comic Yoo Byungjae offers his take on philosophy, sex and childhood memories.","Byungjae Yoo, Byungjae Yoo",48,TV Show,Netflix
Yoo Byungjae: Discomfort Zone,2018,Comedy,5,54 min,Add a Plot,"Y. Joon Chung, Byungjae Yoo",22,TV Show,Netflix
Whitney Cummings: Can I Touch It?,2019,Comedy,6.4,59 min,"In her fourth stand-up special, Whitney Cummings returns to her hometown of Washington, D.C., and riffs on modern feminism, relationships, technology and, of course, sex robots. She also brings a very special guest to say hi.","Marcus Raboy, Whitney Cummings","1,348",TV Show,Netflix
Whindersson Nunes: Adulto,2019,Comedy,6.7,68 min,Brazilian YouTube sensation Whindersson Nunes revisits his humble beginnings and much more in a series of playful stories and peculiar songs.,"Diego Pignataro, Whindersson Nunes",236,TV Show,Netflix
Wanda Sykes: Not Normal,2019,Comedy,7.2,60 min,"Wanda Sykes, delivers a sharp-witted and hilarious critique on the state of the world, addressing her perspective on the current political and cultural climate, which she can only describe as, well - not normal.","Linda Mendoza, Wanda Sykes","1,481",TV Show,Netflix
W. Kamau Bell: Private School Negro,2018,Comedy,6.4,65 min,"Activist and comedian W. Kamau Bell muses on parenting in the Trump era, ""free speech"" dustups, woke children's TV and his fear of going off the grid.","Shannon Hartman, W. Kamau Bell",702,TV Show,Netflix
Vir Das: Losing It,2018,Comedy,7.1,67 min,"Losing It is a Vir Das Journey of Africa , India and America and religions. He touches many topics with audience laughing throughout.","Marcus Raboy, Vir Das","1,021",TV Show,Netflix
Vir Das: For India,2020,Comedy,7.8,75 min,"From the Vedas to Vasco da Gama to vacuous Bollywood plotlines, Vir Das celebrates the history of India with his one-of-a-kind perspective.","Ajay Bhuyan, Vir Das, Vir Das",862,TV Show,Netflix
Vir Das: Abroad Understanding,2017,Comedy,6.8,65 min,"Comedian Vir Das critics nationalism, globalism and bad politics in two performances in New York and New Delhi.","Marcus Raboy, Vir Das","1,488",TV Show,Netflix
Urzila Carlson: Overqualified Loser,2020,Comedy,5.9,62 min,"Stand-up comedian Urzila Carlson keeps the crowd roaring with her thoughts on recasting ""The Biggest Loser,"" sex tape regrets and boxed wine hangovers.","Hayden Guppy, Urzila Carlson",251,TV Show,Netflix
True: Wuzzle Wegg Day,2020,Animation,6.1,23 min,Add a Plot,,8,TV Show,Netflix
True: Rainbow Rescue,2020,"Animation, Family",5.6,23 min,True and Bartleby travel to the other side of the Neverending Rainbow to bring back Dillydally - a brave explorer who's the Rainbow King's best friend.,,10,TV Show,Netflix
Trevor Noah: Son of Patricia,2018,Comedy,7.3,63 min,Noah's South African roots and upbringing merge into his recent American experience making for funny and human juxtapositions and observations.,"David Paul Meyer, Trevor Noah","3,246",TV Show,Netflix
Trevor Noah: Afraid of the Dark,2017,Comedy,7.2,67 min,"Trevor Noah's Netflix one hour standup special. Amazing comedy covering race in America, immigration politics, international relations and more.","David Paul Meyer, Trevor Noah","4,404",TV Show,Netflix
Tracy Morgan: Staying Alive,2017,Comedy,6.1,60 min,"In his first special since the near fatal car accident, Tracy Morgan jokes about life in a coma, his second marriage and the dark side of the family.","Ryan Polito, Tracy Morgan","1,122",TV Show,Netflix
Tom Segura: Mostly Stories,2016,Comedy,7.6,73 min,"The bearded, bawdy and comically bitter Tom Segura gets real about body piercings, the ""Area 51"" of men's bodies, and the lie he told Mike Tyson.","Jay Karas, Rami Hachache, Gabriel G. Alvarez, I. Elijah Baughman, Brandon Brown, Davis Choh","2,824",TV Show,Netflix
Tom Segura: Disgraceful,2018,"Documentary, Comedy",7.6,71 min,Comedian Tom Segura rants about funny things about pop culture and the way of living in 2018.,"Jay Karas, Tom Segura","2,921",TV Show,Netflix
Tom Segura: Ball Hog,2020,Comedy,7.3,70 min,"Tom Segura scores laughs with uncomfortably candid stories about mothers, fathers, following your dreams - and other things you'd rather not think about.","Rami Hachache, Tom Segura","1,822",TV Show,Netflix
Tom Papa: You're Doing Great!,2020,Comedy,7.2,60 min,"Tom Papa takes on body image issues, social media, pets, Staten Island, the ""old days"" and more in a special from his home state of New Jersey.","Gregory Jacobs, Paul C. Morrissey, Tom Papa",575,TV Show,Netflix
Todd Glass: Act Happy,2018,Comedy,5,62 min,Try to keep up as comedian Todd Glass delivers rapid-fire stand-up that bounces from his heart attack to his coming out to how to eat a Kit Kat.,"Scott Moran, Duncan Carey, Jeff Garlin, Todd Glass, Eric Kalver",333,TV Show,Netflix
Todd Barry: Spicy Honey,2017,Comedy,6.8,60 min,"With bone-dry wit, stand-up comic Todd Barry dissects texting emergencies, Hitler's taste in wine, pricey soap, cheap pizza and much more.","Jay Chapman, Todd Barry",729,TV Show,Netflix
Tig Notaro: Happy To Be Here,2018,Comedy,6.6,58 min,Comedian Tig Notaro performs a stand-up set at the historic Heights Theater in Houston.,"Tig Notaro, Indigo Girls, Tig Notaro, Amy Ray, Emily Saliers","1,093",TV Show,Netflix
Tiffany Haddish: Black Mitzvah,2019,Comedy,6.1,55 min,"On her 40th birthday, Tiffany Haddish drops a bombastic special studded with singing, dancing and raunchy reflections on her long road to womanhood.","Linda Mendoza, Tiffany Haddish",715,TV Show,Netflix
Thiago Ventura: Pokas,2020,Comedy,6.8,82 min,"Thiago Ventura jokes about living in a poor Brazilian community, talking about social issues and when actions speak more than words.","Joana Mazzucchelli, Fabio Ock, Thiago Ventura, Patrick Maia",130,TV Show,Netflix
Theo Von: No Offense,2016,"Documentary, Comedy",5.7,67 min,"Southern comedian Theo Von offers up a twisted take on his dating mishaps, meeting Brad Pitt, chasing down fugitive chimpanzees and more.","John Asher, Theo Von",690,TV Show,Netflix
The Spooky Tale of Captain Underpants Hack-a-Ween,2019,"Animation, Short, Action",5.7,45 min,"When Melvin tries to cancel Halloween, clever best friends Harold and George create their own spooky holiday -- and it's a huge success.","Nat Faxon, Jay Gragnani, Ramone Hamilton, Sean Astin",135,TV Show,Netflix
The First Temptation of Christ,2019,"Short, Comedy",4.6,46 min,"Jesus, who's hitting the big 3-0, brings a surprise guest to meet the family.","Rodrigo Van Der Put, Gregório Duvivier, Fábio Porchat, Antonio Tabet, Evelyn Castro","3,049",TV Show,Netflix
Taylor Tomlinson: Quarter-Life Crisis,2020,Comedy,7.4,61 min,"She's halfway through her 20s, and she's over it. Too old to party, too young to settle down, comedian Taylor Tomlinson takes aim at her life choices.","Marcus Raboy, Taylor Tomlinson","1,828",TV Show,Netflix
Taylor Swift: Reputation Stadium Tour,2018,"Documentary, Music",8.3,125 min,Taylor Swift takes the stage and proves she doesn't care about her bad reputation.,"Paul Dugdale, Taylor Swift, Matt Billingslea, Camila Cabello, Giuseppe Giofre","3,746",TV Show,Netflix
Super Monsters: Vida's First Halloween,2019,Animation,5.8,24 min,"The Super Monsters share their Halloween traditions with Vida, then get invited to a Día de los Muertos party in the Howlers' backyard.","Maria J. Cruz, Gigi Saul Guerrero",37,TV Show,Netflix
Sugar High,2020,Reality-TV,7.6,44 min,"Contestants compete in two rounds of sugar sculpting challenges for a prize of $10,000.","Ariel Boles, Hunter March, Jackie Sorkin, Rebecca DeAngelis, Stéphane Tréand",73,TV Show,Netflix
Still Laugh-In: The Stars Celebrate,2019,"Comedy, Music",5.1,60 min,"Hollywood's finest pay tribute to ""Rowan and Martin's Laugh-In"" for an uncensored and unforgettable celebration at The Dolby Theater.","Lily Tomlin, Ruth Buzzi, Tiffany Haddish, Neil Patrick Harris",495,TV Show,Netflix
Steve Martin and Martin Short: An Evening You Will Forget for the Rest of Your Life,2018,Comedy,7.1,74 min,"Comedians and writers Steve Martin and Martin Short perform a live comedy set with music by The Steep Canyon Rangers and jazz pianist, Jeff Babko, at the Peace Center in Greenville, South Carolina.","Marcus Raboy, Steve Martin, Martin Short, Jeff Babko","2,156",TV Show,Netflix
Spirit Riding Free: Spirit of Christmas,2019,"Animation, Adventure, Drama",6.1,45 min,Add a Plot,"Allan Jacobsen, Kevin Wotton, Stephen Cooper, Josh Taback, Amber Frank, Bailey Gambertoglio, Sydney Park, Evan Agos",53,TV Show,Netflix
Sofía Niño de Rivera: Selección natural,2018,Comedy,6.8,,Add a Plot,"Raúl Campos, Jan Suter, Sofia Niño de Rivera",203,TV Show,Netflix
Sofía Niño de Rivera: Expuesta,2016,Comedy,7.4,,"Stand up comedian Sofía Niño de Rivera stars in her critically acclaimed one-hour-long debut comedy special for Netflix, ""Exposed"", where she tells personal stories with with a racy humor ... See full summary »","Raúl Campos, Jan Suter, Sofia Niño de Rivera",268,TV Show,Netflix
Simon Amstell: Set Free,2019,Comedy,6.4,51 min,"Comedies Honest, introspective comic Simon Amstell digs deep and delivers a uniquely vulnerable stand-up set on love, ego, intimacy and ayahuasca.","Julia Knowles, Simon Amstell",642,TV Show,Netflix
Seth Rogen's Hilarity for Charity,2018,Comedy,5,70 min,Seth Rogen hosts an evening of comedy to raise awareness for Alzheimer's disease.,"Ryan Polito, Benji Allonbe, Ike Barinholtz, Sacha Baron Cohen, Lakecia Benjamin","2,127",TV Show,Netflix
Seth Meyers: Lobby Baby,2019,Comedy,7.5,61 min,SNL alumnus and subversive master of late-night TV Seth Meyers comes out from behind the desk to share some lighthearted stories from his own life.,"Neal Brennan, Jonathan Chacko, Seth Meyers","1,940",TV Show,Netflix
Sebastián Marcelo Wainraich,2018,Comedy,6.2,,"The Argentine comedian Sebastian Wainraich finds the comedic side to him day to day, from the minibars to why the funerals are better than the weddings.","Raúl Campos, Jan Suter, Sebastián Wainraich",95,TV Show,Netflix
Sebastian Maniscalco: Stay Hungry,2019,Comedy,7.1,65 min,"Sebastian's captivating storytelling keeps the audience engaged as he unpacks spin classes, pregnancy photoshoots, and wedding dances.","Rik Reinholdtsen, Sebastian Maniscalco","1,033",TV Show,Netflix
Saverio Raimondo: Il Satiro Parlante,2019,Comedy,6,53 min,Add a Plot,Saverio Raimondo,35,TV Show,Netflix
Sarah Silverman: A Speck of Dust,2017,Comedy,6.8,71 min,"In her first comedy special post-health scare, Sarah Silverman shares a mix of fun facts, sad truths and yeah-she-just-went-there moments.","Liam Lynch, Sarah Silverman, Troy","3,211",TV Show,Netflix
Sarah Cooper: Everything's Fine,2020,Comedy,5.7,49 min,"A variety special full of issues of politics, race, gender and class. Sarah will also be joined by special guests.","Natasha Lyonne, Winona Ryder, Marisa Tomei, Aubrey Plaza, Ben Stiller","1,056",TV Show,Netflix
Sam Jay: 3 in the Morning,2020,Comedy,6.1,64 min,"Comedian and ""Saturday Night Live"" writer Sam Jay serves up fresh takes on relationships, travel nightmares, the audacity of white people and more.","Kristian Mercado, Sam Jay",305,TV Show,Netflix
Salvador Martinha: Tip of the Tongue,2016,Comedy,5.8,65 min,"Comedian Salvador Martinha talks technology, trends, relationships and more in a stand-up special that doesn't take itself too seriously.","Vasco Vilarinho, Salvador Martinha",64,TV Show,Netflix
Ryan Hamilton: Happy Face,2017,"Documentary, Comedy",7.3,56 min,"Small-town import Ryan Hamilton charms New York with folksy comic observations on big-city life, hot-air ballooning and going to Disney World alone.","Marcus Raboy, Ryan Hamilton",772,TV Show,Netflix
Russell Peters: Notorious,2013,Comedy,7.1,71 min,"Global comedy star Russell Peters leaves no ethnic or cultural stereotype unstrapped in this outrageous stand-up appearance in Sydney, Australia.","David Higby, Russell Peters","1,504",TV Show,Netflix
Russell Peters: Almost Famous,2016,Comedy,6.6,73 min,"Canadian comedy star, Russell Peters, visits Toronto's Massey Hall for a homecoming stand-up comedy performance. Russell returns to his trademark material of ethnic jokes and audience interaction.","David Higby, Russell Peters, Jus Reign","1,648",TV Show,Netflix
Russell Howard: Recalibrate,2017,Comedy,7.4,69 min,"Comedian Russell Howard brings his manic energy to a new stand-up special that tackles politics, childhood and why he's a jerk.","Russell Howard, Russell Howard","1,267",TV Show,Netflix
Russell Brand: Re: Birth,2018,Comedy,6.5,63 min,Russell Brand gets loquacious in London as he ruminates on the state of the world and marvels over how his life changed the moment he became a father.,"Chris Howe, Russell Brand","1,040",TV Show,Netflix
Rory Scovel Tries Stand-Up for the First Time,2017,"Documentary, Comedy",6.7,66 min,"Comedian Rory Scovel storms the stage in Atlanta, where he shares unfocused thoughts about things that mystify him, relationships and the thong song","Scott Moran, Rory Scovel, Jack White, Ben Swank, Ben Kronberg",727,TV Show,Netflix
Ronny Chieng: Asian Comedian Destroys America,2019,Comedy,7.4,63 min,"Ronny Chieng (""The Daily Show,"" ""Crazy Rich Asians"") takes center stage in this stand-up special and riffs on modern American life and more.","Sebastian DiNatale, Ronny Chieng","2,157",TV Show,Netflix
"Ron White: If You Quit Listening, I'll Shut Up",2018,Comedy,6.5,63 min,"Ron ""Tater Salad"" White dishes out his signature brand of cynicism, riffing on sex, celebrity and the sinister habits of wild geese.","Tom Forrest, Ron White",695,TV Show,Netflix
Rodney King,2017,"Comedy, Drama",5.8,52 min,Roger Guenveur Smith performs his one man show focusing on the life and times of Rodney King.,"Spike Lee, Roger Guenveur Smith",500,TV Show,Netflix
Rodney Carrington: Here Comes the Truth,2017,"Documentary, Comedy",4.3,66 min,"Raunchy country comic and musician Rodney Carrington jokes and sings about life in his 40s, poking fun at sex, relationships and gaining weight.",Rodney Carrington,137,TV Show,Netflix
"Rob Schneider: Asian Momma, Mexican Kids",2020,Comedy,5.3,44 min,Comedian Rob Schneider gives viewers a look at his family and personal life through humorous anecdotes about potty training his young daughters as well as his own pig potential and a surprise duet performance with his daughter.,"Tyler Spindel, Elle King, Rob Schneider",533,TV Show,Netflix
Ricky Gervais: Humanity,2018,Comedy,7.9,79 min,Live performance of British comedian Ricky Gervais filmed in London's Eventim Apollo.,"John L. Spencer, Ricky Gervais","14,384",TV Show,Netflix
Ricardo Quevedo: Los Amargados Somos Mas,2019,Comedy,7.3,58 min,Add a Plot,Ricardo Quevedo,82,TV Show,Netflix
Ricardo Quevedo: Hay gente así,2018,Comedy,6.5,,"Standup monologue from Colombian comedian Ricardo Quevedo where he shares about his point of view on things such as the way we talk, how relationships work and more.","Raúl Campos, Jan Suter, Ricardo Quevedo",92,TV Show,Netflix
Ricardo O'Farrill: Abrazo navideño,2016,Comedy,5.7,,Add a Plot,"Raúl Campos, Jan Suter, Ricardo O'Farrill",55,TV Show,Netflix
Ricardo O'Farrill: Abrazo genial,2016,Comedy,5.7,,"Ricardo OFarrill brings his sharp, observational humor to the stage with a relentless sarcasm and specific Mexican sensibility. Prepare for mockery","Jan Suter, Raúl Campos, Ricardo O'Farrill",99,TV Show,Netflix
Reggie Watts: Spatial,2016,"Comedy, Music",6.1,61 min,"Completely improvised show weaving together sketches, short stories, and dream sequences, filmed live on a soundstage in Los Angeles, Watts waxes poetic about flight, grits, and guns.","Benjamin Dickinson, Rory Scovel, Reggie Watts",456,TV Show,Netflix
"Ray Romano: Right Here, Around the Corner",2019,"Documentary, Comedy",7.2,58 min,"Ray Romano cut his stand-up teeth at the Comedy Cellar in New York. Now, in his first comedy special in 23 years, he returns to where it all began.","Michael Showalter, Ray Romano, Richard Sarvate, Ryan Reiss","1,421",TV Show,Netflix
Rafinha Bastos: Ultimato,2018,Comedy,6.5,62 min,"An off-color joke nearly cost him everything. Brazilian comic Rafinha Bastos talks about that an much more, from his divorce to finding love again.","Rudge Campos, Junior Carelli, Rafinha Bastos",174,TV Show,Netflix
Pete Davidson: Alive from New York,2020,Comedy,6,49 min,Comedian Pete Davidson's intimate and candid stand-up special shot live in New York City.,"Jason Orley, Pete Davidson","2,614",TV Show,Netflix
Patton Oswalt: Talking for Clapping,2016,"Documentary, Comedy",6.8,65 min,"Patton Oswalt takes the stage in San Francisco, where he talks about San Franciscans, the difficulties of being PC, fatherhood, his worst stand up experience, and the worlds most horrific Birthday Clown.","Patton Oswalt, Boots Riley","1,793",TV Show,Netflix
Patton Oswalt: I Love Everything,2020,Comedy,6.4,66 min,Turning 50. Finding love again. Buying a house. Experiencing existential dread at Denny's. Life comes at Patton Oswalt fast in this stand-up special.,"Marcus Raboy, Patton Oswalt, Bob Rubin",943,TV Show,Netflix
Patton Oswalt: Annihilation,2017,Comedy,7.2,66 min,"Patton Oswalt, despite a personal tragedy, produces his best standup yet. Focusing on the tribulations of the Trump era and life after the loss of a loved one, Oswalt continues his journey to contribute joy to the world.","Bobcat Goldthwait, Patton Oswalt","2,106",TV Show,Netflix
Park Na-rae: Glamour Warning,2019,Comedy,4.7,62 min,"Stand-up comedy special featuring one of Korea's most beloved comedians, Park Narae.","Kim Joo-Hyung, Na Rae Park",45,TV Show,Netflix
Oprah Winfrey Presents: When They See Us Now,2019,Talk-Show,7.7,61 min,"Oprah Winfrey talks with the exonerated men once known as the Central Park Five, plus the cast and producers who tell their story in ""When they see us""","Mark Ritchie, Asante Blackk, Ava DuVernay, Caleel Harris, Ethan Herisse","2,055",TV Show,Netflix
"Norm Macdonald: Hitler's Dog, Gossip & Trickery",2017,"Documentary, Comedy",7.3,61 min,"In this new stand-up special, Norm Macdonald delivers sly, deadpan observations from an older -- and perhaps even wiser -- point of view.","Liz Plonka, Norm MacDonald","2,134",TV Show,Netflix
Nikki Glaser: Bangin',2019,Comedy,5.9,63 min,"Nikki Glaser bares all in a blistering stand-up special about sex, sobriety and getting over her own insecurities. And she won't spare you the details.","Nicholaus Goossen, Nikki Glaser","1,194",TV Show,Netflix
Nick Offerman: American Ham,2014,"Documentary, Comedy",6.7,78 min,"A live taping of Nick Offerman's one-man show at New York's historic Town Hall theater, featuring a collection of anecdotes, songs and woodworking/oral-sex techniques.","Jordan Vogt-Roberts, Marc Evan Jackson, Megan Mullally, Nick Offerman","1,212",TV Show,Netflix
Neal Brennan: 3 Mics,2017,Comedy,7.9,65 min,"Neal Brennan is taking multitasking to a whole new level in this stand up special, which features the comedian switching between three different microphones symbolizing three different styles of comedy.","Neal Brennan, Neal Brennan","2,708",TV Show,Netflix
Nate Bargatze: The Tennessee Kid,2019,Comedy,7.6,60 min,"Comic Nate Bargatze touches on air travel, cheap weddings, college football, chocolate milk and the perils of ordering coffee in this stand-up special.","Ryan Polito, Nate Bargatze","1,077",TV Show,Netflix
Natalia Valdebenito: El especial,2018,Comedy,4.7,,Add a Plot,"Raúl Campos, Jan Suter, Natalia Valdebenito",75,TV Show,Netflix
Mo Gilligan: Momentum,2019,Comedy,6.3,64 min,"Mo Gilligan blends smooth moves and sharp humor as he riffs on humble beginnings, family dynamics and the complex art of dancing in the club.","Chris Howe, Mo Gilligan",312,TV Show,Netflix
Mo Amer: The Vagabond,2018,"Documentary, Comedy",7.3,56 min,Add a Plot,"Stan Lathan, Mohammed Amer",532,TV Show,Netflix
Mike Epps: Only One Mike,2019,Comedy,4.8,63 min,"A 2019 stand-up comedy special by comedian Mike Epps, where he tackles sexual misconduct, special education, aging body parts and more.","Kevin Bray, Mike Epps",234,TV Show,Netflix
Mike Birbiglia: The New One,2019,Comedy,7.7,85 min,Comedian Mike Birbiglia hits Broadway with a hilarious yet profound one-man show that recounts his emotional and physical journey to parenthood.,"Seth Barrish, Mike Birbiglia","1,350",TV Show,Netflix
Mike Birbiglia: Thank God for Jokes,2017,Comedy,7.5,70 min,Mike Birbiglia tells stories about his life as a semi-famous comedian/filmmaker and reflects on the meaning of good or bad jokes.,"Seth Barrish, Mike Birbiglia, Mike Birbiglia","2,133",TV Show,Netflix
Mike Birbiglia: My Girlfriend's Boyfriend,2013,"Documentary, Comedy, Romance",8,76 min,Mike Birbiglia tells the touching story of his believing and disbelieving in love.,"Seth Barrish, Mike Birbiglia","2,892",TV Show,Netflix
Michelle Wolf: Joke Show,2019,Comedy,7.2,59 min,"Comedian Michelle Wolf takes on outrage culture, massages, childbirth, feminism and much more (like otters) in a stand-up special from New York City.","Lance Bangs, Michelle Wolf","1,206",TV Show,Netflix
Michelle Buteau: Welcome to Buteaupia,2020,Comedy,6.9,58 min,"Letting loose with a goblet of frosé in hand, Michelle Buteau delivers a dynamic hour of comedy that delves into parenthood, cultural difference, and the overlooked value of short men.","Page Hurwitz, Michelle Buteau",231,TV Show,Netflix
Michael McIntyre: Showman,2020,Comedy,7.1,62 min,"Charming comic Michael McIntyre talks family, technology, sharks, accents and the time he confused himself for a world leader in this stand-up special.","Chris Howe, Michael McIntyre",631,TV Show,Netflix
Michael Che Matters,2016,Comedy,7.1,61 min,"Jesus, Guns, Black Lives Matter. White girls dancing, Honest, uncompromising comedy where no topic is out of bounds","Osmany Rodriguez, Michael Che, DJ Cipha Sounds, Jeremy Gaddie, Jeff Motley","2,064",TV Show,Netflix
"Michael Bolton's Big, Sexy Valentine's Day Special",2017,"Comedy, Music, Musical",6.7,54 min,"After Santa tells Michael Bolton that he needs 75,000 new babies by Christmas to meet toy supply, Michael Bolton hosts a sexy telethon to get the world to start making love.","Scott Aukerman, Akiva Schaffer, Michael Bolton, Sarah Shahi, Adam Scott, Matthew Kimbrough","1,849",TV Show,Netflix
Maz Jobrani: Immigrant,2017,Comedy,6.7,112 min,"In this very funny comedy show, Maz mainly focuses on current political environment especially by telling jokes about Donald Trump and his anti-immigrant politics. During the show he talks ... See full summary »","Maz Jobrani, Maz Jobrani",712,TV Show,Netflix
